{
  "$schema": "https://json-schema.org/draft/2020-12/schema",
  "$id": "https://sdcstudio.com/schemas/vsl/settlement-receipt-1.0.schema.json",
  "title": "VSL Settlement Receipt 1.0",
  "description": "A signed set of hash commitments describing a validated, authorized, dual-triggered exchange. A Receipt never contains the payload. FROZEN at 1.0 (VSL-PRD \u00a713.3): a Receipt is a long-lived artifact that a third party must be able to check years later against this published schema, so no field may be added, removed or reinterpreted within 1.0.",
  "type": "object",
  "additionalProperties": false,
  "required": [
    "version",
    "canonicalization",
    "receipt_id",
    "timestamp",
    "payload_hash",
    "payload_media_type",
    "schema_ct_id",
    "schema_url",
    "schema_hash",
    "rm_version",
    "validation",
    "provenance_hash",
    "governance",
    "settlement",
    "previous_hash",
    "receipt_hash",
    "signatures"
  ],
  "properties": {
    "version": {
      "const": "1.0",
      "description": "Receipt format version. A different value means a different schema; a verifier that does not recognise it must refuse rather than guess."
    },
    "canonicalization": {
      "const": "rfc8785",
      "description": "The canonicalization used for every hash in this Receipt. Committed inside receipt_hash so the scheme cannot be reinterpreted under a weaker one. RFC 8785 conformant, not 'aligned': see VSL-PRD \u00a75.2 and sdcgovernance.jcs."
    },
    "receipt_id": {
      "type": "string",
      "pattern": "^[a-z][a-z0-9]{23}$",
      "description": "CUID2, 24 characters. Assigned when the Receipt is built, therefore known to both parties before either signs a trigger."
    },
    "timestamp": {
      "type": "string",
      "format": "date-time",
      "pattern": "^\\d{4}-\\d{2}-\\d{2}T\\d{2}:\\d{2}:\\d{2}(\\.\\d+)?Z$",
      "description": "RFC 3339, UTC, Z suffix required. Local offsets are refused so canonical bytes cannot vary by issuer locale."
    },
    "payload_hash": {
      "$ref": "#/$defs/sha256",
      "description": "SHA-256 over the canonical payload bytes. The payload itself is never carried."
    },
    "payload_media_type": {
      "type": "string",
      "pattern": "^[a-z]+/[a-zA-Z0-9.+-]+$",
      "description": "Media type of the committed payload, e.g. application/xml or application/ld+json."
    },
    "schema_ct_id": {
      "type": "string",
      "pattern": "^[a-z][a-z0-9]{23}$",
      "description": "CUID2 of the bound component in the catalog."
    },
    "schema_url": {
      "type": "string",
      "format": "uri",
      "description": "Unauthenticated location of the published component (VSL-PRD \u00a75.6). Present so a receiving party who does not run SDC can fetch the schema and re-validate without depending on us."
    },
    "schema_hash": {
      "$ref": "#/$defs/sha256",
      "description": "SHA-256 over the published schema bytes, so the fetch at schema_url is checkable."
    },
    "rm_version": {
      "enum": [
        "SDC4",
        "SDC5"
      ],
      "description": "Reference model the component was published under. Recorded so a Receipt survives a reference-model change."
    },
    "validation": {
      "type": "object",
      "additionalProperties": false,
      "required": [
        "valid",
        "structural_errors",
        "semantic_errors",
        "recovered",
        "ev_injections",
        "validator_version"
      ],
      "properties": {
        "valid": {
          "type": "boolean"
        },
        "structural_errors": {
          "type": "integer",
          "minimum": 0
        },
        "semantic_errors": {
          "type": "integer",
          "minimum": 0
        },
        "recovered": {
          "type": "boolean",
          "description": "True when ExceptionalValues were injected to reach a valid document."
        },
        "ev_injections": {
          "type": "array",
          "description": "ISO 21090 exceptional values injected during recovery. Empty when recovered is false.",
          "items": {
            "type": "object",
            "additionalProperties": false,
            "required": [
              "xpath",
              "ev_type",
              "reason"
            ],
            "properties": {
              "xpath": {
                "type": "string",
                "minLength": 1
              },
              "ev_type": {
                "type": "string",
                "minLength": 1
              },
              "reason": {
                "type": "string",
                "minLength": 1
              }
            }
          }
        },
        "validator_version": {
          "type": "string",
          "pattern": "^sdcvalidator \\d+\\.\\d+\\.\\d+$",
          "description": "Exact validator build, so step 5 of the verification procedure is reproducible."
        }
      }
    },
    "provenance_hash": {
      "$ref": "#/$defs/sha256",
      "description": "SHA-256 over the canonical provenance chain."
    },
    "governance": {
      "type": "object",
      "additionalProperties": false,
      "required": [
        "decision",
        "dimensions_checked",
        "receipt_hash",
        "receipt_url"
      ],
      "properties": {
        "decision": {
          "enum": [
            "PERMIT",
            "DENY",
            "INDETERMINATE"
          ],
          "description": "OASIS XACML 3.0 \u00a75.53 decision."
        },
        "dimensions_checked": {
          "type": "array",
          "items": {
            "type": "string",
            "minLength": 1
          },
          "uniqueItems": true
        },
        "receipt_hash": {
          "$ref": "#/$defs/sha256",
          "description": "receipt_hash of the sdcgovernance Receipt that produced `decision`. A holder of that Receipt can confirm it hashes to this value, re-run sdcgovernance against it, and follow its own previous_hash chain."
        },
        "receipt_url": {
          "oneOf": [
            {
              "type": "string",
              "format": "uri"
            },
            {
              "type": "null"
            }
          ],
          "description": "Unauthenticated location of the governance Receipt, or null when it is not published. Mirrors the schema_ct_id / schema_url / schema_hash pattern in \u00a75.6: a receiving party who holds neither can still fetch and check. Declared now because a frozen format cannot gain it later."
        }
      },
      "description": "The governance verdict AND a commitment to the evidence that produced it. Carrying the decision alone would make it an assertion a verifier cannot check, and would leave the sdcgovernance hash chain unlinked; binding by hash is the join described in VSL-PRD \u00a73.3."
    },
    "settlement": {
      "type": "object",
      "additionalProperties": false,
      "required": [
        "condition_hash",
        "parties",
        "triggers"
      ],
      "properties": {
        "condition_hash": {
          "$ref": "#/$defs/sha256",
          "description": "SHA-256 over the canonical release condition."
        },
        "parties": {
          "type": "array",
          "minItems": 2,
          "uniqueItems": true,
          "items": {
            "$ref": "#/$defs/key_id"
          },
          "description": "Key ids expected to trigger. A settlement completes when every listed party appears in triggers."
        },
        "triggers": {
          "type": "array",
          "uniqueItems": true,
          "description": "Appended after receipt_hash is computed, so triggers are NOT covered by it (see $comment on receipt_hash). Each trigger is independently verifiable and order does not matter.",
          "items": {
            "type": "object",
            "additionalProperties": false,
            "required": [
              "key_id",
              "signature",
              "timestamp"
            ],
            "properties": {
              "key_id": {
                "$ref": "#/$defs/key_id"
              },
              "signature": {
                "$ref": "#/$defs/signature",
                "description": "ES256 over the RFC 8785 canonical form of {\"condition_hash\": ..., \"receipt_id\": ...}. \u2605 receipt_id is included deliberately: a signature over condition_hash alone would be replayable into any other Receipt sharing the same release condition. Both values are fixed before either party signs, so independent out-of-order signing is preserved."
              },
              "timestamp": {
                "type": "string",
                "pattern": "^\\d{4}-\\d{2}-\\d{2}T\\d{2}:\\d{2}:\\d{2}(\\.\\d+)?Z$"
              }
            }
          }
        }
      }
    },
    "previous_hash": {
      "oneOf": [
        {
          "$ref": "#/$defs/sha256"
        },
        {
          "type": "null"
        }
      ],
      "description": "receipt_hash of the prior Receipt in this chain, or null for the first."
    },
    "receipt_hash": {
      "$ref": "#/$defs/sha256",
      "$comment": "SHA-256 over the RFC 8785 canonical form of this object with receipt_hash, signatures and settlement.triggers removed. Triggers are excluded because \u00a75.4 appends them after hashing so the parties can sign independently and out of order; each trigger carries its own signature and is bound to this Receipt through receipt_id.",
      "description": "Integrity commitment over the Receipt content."
    },
    "signatures": {
      "type": "array",
      "minItems": 1,
      "uniqueItems": true,
      "description": "Issuer signatures over receipt_hash. Not covered by receipt_hash itself.",
      "items": {
        "type": "object",
        "additionalProperties": false,
        "required": [
          "key_id",
          "alg",
          "sig"
        ],
        "properties": {
          "key_id": {
            "$ref": "#/$defs/key_id"
          },
          "alg": {
            "const": "ES256",
            "description": "JOSE algorithm name (RFC 7518 \u00a73.4), which defines ECDSA P-256 with SHA-256 and fixes the signature encoding as the P1363 r||s pair. Naming the JOSE algorithm therefore pins the wire encoding; there is no separate encoding field to disagree about."
          },
          "sig": {
            "$ref": "#/$defs/signature"
          }
        }
      }
    }
  },
  "$defs": {
    "sha256": {
      "type": "string",
      "pattern": "^[0-9a-f]{64}$",
      "description": "SHA-256 as 64 lowercase hex characters. Case is pinned so the value has one canonical form."
    },
    "key_id": {
      "type": "string",
      "minLength": 1,
      "maxLength": 256,
      "description": "Identifier resolvable at /.well-known/sdcstudio-signing-keys.json, or against a key retained earlier. Verification must work from a cached key."
    },
    "signature": {
      "type": "string",
      "pattern": "^[A-Za-z0-9_-]{86}$",
      "description": "ES256 signature: the 64-byte P1363 r||s pair, base64url encoded without padding, which is 86 characters. base64url rather than base64 follows JOSE and keeps the value safe in URLs and headers."
    }
  }
}
