{
  "version": "1.0",
  "canonicalization": "rfc8785",
  "receipt_id": "k7m2p9x4qw8vzn3hjt6bcdfg",
  "timestamp": "2026-08-30T14:22:07Z",
  "payload_hash": "ffffffffffffffffffffffffffffffffffffffffffffffffffffffffffffffff",
  "payload_media_type": "application/xml",
  "schema_ct_id": "jsi5yxnvzsmsisgn2bvelkni",
  "schema_url": "https://sdcstudio.com/catalog/jsi5yxnvzsmsisgn2bvelkni/published.xsd",
  "schema_hash": "d842a40bcc01ca25f96365f31c5385cd99397fb0d9938e7f81bb8d7959653e7e",
  "rm_version": "SDC4",
  "validation": {
    "valid": true,
    "structural_errors": 0,
    "semantic_errors": 1,
    "recovered": true,
    "ev_injections": [
      {
        "xpath": "/ShippingManifest/Consignment/GrossWeight",
        "ev_type": "NI",
        "reason": "element absent in source; ISO 21090 no-information"
      }
    ],
    "validator_version": "sdcvalidator 4.5.0"
  },
  "provenance_hash": "db57d562708ea0f03210d0098a5e56e5650a75c878bf6d71c3ba429a96447bb7",
  "governance": {
    "decision": "PERMIT",
    "dimensions_checked": [
      "workflow",
      "attestation",
      "party_role"
    ],
    "receipt_hash": "bcb82d7c76ad34e3ddd8beb33771947ba83335f9703e7c95877a3d7d57c5b828",
    "receipt_url": null
  },
  "settlement": {
    "condition_hash": "508ebba79151dc8a081bc920ab224cb08f5a160affc8c5e4b6b1facd9811c983",
    "parties": [
      "https://vendor.example/.well-known/vsl-key.json",
      "did:web:partner.example"
    ],
    "triggers": [
      {
        "key_id": "https://vendor.example/.well-known/vsl-key.json",
        "signature": "wU3GCnn_B00qoH7lNpaL7nxL5RMJsJ34iU31ngGl7IAx-88WGrVuGTgWqPY8aZmrIwK9tPD5s6KQlpX1lW1WDA",
        "timestamp": "2026-08-30T15:03:12Z"
      },
      {
        "key_id": "did:web:partner.example",
        "signature": "a4yf6l_buVKxFBMgXpEoUDsLCQvN3b5TDHpmUcAylBD5fY65OkU4R14NSItwguyRMvKV8ATj-7muJCSvNcxGng",
        "timestamp": "2026-08-30T16:41:55Z"
      }
    ]
  },
  "previous_hash": null,
  "receipt_hash": "604a1f6ad1bc7f9aae05598891f1c5b254ceb84f303ad402fb05284de38103fb",
  "signatures": [
    {
      "key_id": "sdcstudio-signing-key-v1",
      "alg": "ES256",
      "sig": "pnwYds171PTxUbNgU2WcibsE9ADxr2pEB4bHBPa6iZgSVJzwDbRlW8u5iDTPuKxpahriRgIatLnCdTtetEynoA"
    }
  ]
}
